PPN	creator	dataProvider	date	format	identifier	isShownAt	issued	object	provider	publisher	rights	source	spatial	subject	title	type
PPN834837250	Blumeyer, Johann Heinrich  Völger, Otto Heinrich  Grupe, Christian Ulrich	Staatsbibliothek zu Berlin - Preußischer Kulturbesitz	1725	image/jpeg	http://resolver.staatsbibliothek-berlin.de/SBB0001B0EB00000000	http://resolver.staatsbibliothek-berlin.de/SBB0001B0EB00000000	1725	http://digital.staatsbibliothek-berlin.de/europeana/PPN834837250/00000001.tif	Staatsbibliothek zu Berlin - Preußischer Kulturbesitz	Holwein	Open Access	Blumeyer, Johann Heinrich  Völger, Otto Heinrich  Grupe, Christian Ulrich: Die Völlige Erndte auf eingeschickte Erstlinge, Solte, als an die Durch unvermutheten, doch seeligen, Tod Des ... Herrn Otto Heinrich Völgers, Königl. Groß-Brit. und Chur-Fürstl. Braunschw. Lüneb. gewesenen ... Consistorial-Raths, wie auch ... ältesten Bürger-Meisters der Königl. und Chur-Fürstl. Residence-Stadt Hannover, vacant gewordenen Bürger-Meister-Stelle Der ... Herr Christian Ulrich Grupe, Bißheriger Hochmeritirter Syndicus Eines Hoch-Edlen und Hochweisen Raths hieselbst, Durch einhellige Wahl den XIten Augusti dieses 1725sten Jahres zum Bürger-Meister erwehlet wurde, Zur schuldigsten gratulation ... Joh. Heinr. Blumeyer, h.t. Con-Rect. sch. Hannov.. [Hannover]  Berlin 1725	[Hannover]	Historische Drucke	Die Völlige Erndte auf eingeschickte Erstlinge, Solte, als an die Durch unvermutheten, doch seeligen, Tod Des ... Herrn Otto Heinrich Völgers, Königl. Groß-Brit. und Chur-Fürstl. Braunschw. Lüneb. gewesenen ... Consistorial-Raths, wie auch ... ältesten Bürger-Meisters der Königl. und Chur-Fürstl. Residence-Stadt Hannover, vacant gewordenen Bürger-Meister-Stelle Der ... Herr Christian Ulrich Grupe, Bißheriger Hochmeritirter Syndicus Eines Hoch-Edlen und Hochweisen Raths hieselbst, Durch einhellige Wahl den XIten Augusti dieses 1725sten Jahres zum Bürger-Meister erwehlet wurde, Zur schuldigsten gratulation ... Joh. Heinr. Blumeyer, h.t. Con-Rect. sch. Hannov.	Monograph
PPN829366342	Charisius, Adam Gottlieb  Daschitzky, Johann Erdmann	Staatsbibliothek zu Berlin - Preußischer Kulturbesitz	1709	image/jpeg	http://resolver.staatsbibliothek-berlin.de/SBB0001A66700000000	http://resolver.staatsbibliothek-berlin.de/SBB0001A66700000000	1709	http://digital.staatsbibliothek-berlin.de/europeana/PPN829366342/00000001.tif	Staatsbibliothek zu Berlin - Preußischer Kulturbesitz	Baumann	Open Access	Charisius, Adam Gottlieb  Daschitzky, Johann Erdmann: Als Cum Titul: Herr Johann Erdman[n] Daschitzky, Bißheriger wohl-meritierter Pro-Rector und Profess. Philosoph. & Græcar. Literar. des Gymnas: zu St. Maria Magdalena in Breßlau/ den 3. Octobr. 1709 ... Als Pro-Rector und Professor des berühmten Gymnasii zu St. Elisabet introduciret wurde/ Suchte Selbigem mit diesen geringen Zeilen ... zu gratuliren Adam Gottlieb Charisius, von Schweidnitz aus Schlesien. Breßlau  Berlin 1709	Breßlau	Historische Drucke	Als Cum Titul: Herr Johann Erdman[n] Daschitzky, Bißheriger wohl-meritierter Pro-Rector und Profess. Philosoph. & Græcar. Literar. des Gymnas: zu St. Maria Magdalena in Breßlau/ den 3. Octobr. 1709 ... Als Pro-Rector und Professor des berühmten Gymnasii zu St. Elisabet introduciret wurde/ Suchte Selbigem mit diesen geringen Zeilen ... zu gratuliren Adam Gottlieb Charisius, von Schweidnitz aus Schlesien	Monograph
PPN834705958	Böhmer, Justus Fridericus  Böhmer, Justus Christophorus	Staatsbibliothek zu Berlin - Preußischer Kulturbesitz	1723	image/jpeg	http://resolver.staatsbibliothek-berlin.de/SBB0001B07400000000	http://resolver.staatsbibliothek-berlin.de/SBB0001B07400000000	1723	http://digital.staatsbibliothek-berlin.de/europeana/PPN834705958/00000001.tif	Staatsbibliothek zu Berlin - Preußischer Kulturbesitz	None	Open Access	Böhmer, Justus Fridericus  Böhmer, Justus Christophorus: Reverendissimo Viro Ivsto Christophoro Böhmer Sacrosanctae Theologiae Doctori ... In Academia Ivlia Per Plvres Annos Professori Ordinario Celeberrimo Nvnc Vero Electo Atqve Regia Avctoritate Confirmato Liberi Et Imperialis Coenobii Loccvmensis Abbati ... In Dvcatv Calenbergensi Primati Patrono Patrvo Atqve Compatri Svo Mvltis Nominibvs Devenerando. Hannoverae  Berlin 1723	Hannoverae	Historische Drucke	Reverendissimo Viro Ivsto Christophoro Böhmer Sacrosanctae Theologiae Doctori ... In Academia Ivlia Per Plvres Annos Professori Ordinario Celeberrimo Nvnc Vero Electo Atqve Regia Avctoritate Confirmato Liberi Et Imperialis Coenobii Loccvmensis Abbati ... In Dvcatv Calenbergensi Primati Patrono Patrvo Atqve Compatri Svo Mvltis Nominibvs Devenerando	Monograph
PPN829366091	Lange, Johann Michael	Staatsbibliothek zu Berlin - Preußischer Kulturbesitz	1709	image/jpeg	http://resolver.staatsbibliothek-berlin.de/SBB0001A66600000000	http://resolver.staatsbibliothek-berlin.de/SBB0001A66600000000	1709	http://digital.staatsbibliothek-berlin.de/europeana/PPN829366091/00000001.tif	Staatsbibliothek zu Berlin - Preußischer Kulturbesitz	Meyer	Open Access	Lange, Johann Michael: Als Der Hoch-Ehrwürdige, Hoch-Achtbare und Hoch-Gelahrte Herr Johann Michael Lange, SS. Theol. D. bißheriger Hochverdienter P. P. und Treufleißiger Seelsorger der Gemeine zu Altdorf, von dar nach Prenslow zum ... Pastorat und Inspectorat allda abzog, wollten ihren herzlichen Wehmuth ... bezeugen verschiedene ... gehorsame Beicht-Kinder. Altdorf  Berlin 1709	Altdorf	Historische Drucke	Als Der Hoch-Ehrwürdige, Hoch-Achtbare und Hoch-Gelahrte Herr Johann Michael Lange, SS. Theol. D. bißheriger Hochverdienter P. P. und Treufleißiger Seelsorger der Gemeine zu Altdorf, von dar nach Prenslow zum ... Pastorat und Inspectorat allda abzog, wollten ihren herzlichen Wehmuth ... bezeugen verschiedene ... gehorsame Beicht-Kinder	Monograph
PPN834616327	Eireval, ...  Meibom, Brandan	Staatsbibliothek zu Berlin - Preußischer Kulturbesitz	1717	image/jpeg	http://resolver.staatsbibliothek-berlin.de/SBB0001B05100000000	http://resolver.staatsbibliothek-berlin.de/SBB0001B05100000000	1717	http://digital.staatsbibliothek-berlin.de/europeana/PPN834616327/00000001.tif	Staatsbibliothek zu Berlin - Preußischer Kulturbesitz	Hamm	Open Access	Eireval, ...  Meibom, Brandan: Tres humble felicitation en vers franc̜ois A Monsieur Brandan Meibom Docteur & Professeur en medecine au jour glorieux où il a ête chargé du sceptre & du gouvernement academique & installé tres digne & Magnifique Pro-Recteur de la tres illustre & tres celebre Université de Helmstädt Le 14me de Janvier 1717. Helmstädt  Berlin 1717	Helmstädt	Historische Drucke	Tres humble felicitation en vers franc̜ois A Monsieur Brandan Meibom Docteur & Professeur en medecine au jour glorieux où il a ête chargé du sceptre & du gouvernement academique & installé tres digne & Magnifique Pro-Recteur de la tres illustre & tres celebre Université de Helmstädt Le 14me de Janvier 1717	Monograph
PPN828817367	Habesci, Elias  Wittenberg, Albrecht	Staatsbibliothek zu Berlin - Preußischer Kulturbesitz	1785	image/jpeg	http://resolver.staatsbibliothek-berlin.de/SBB0001A50400000000	http://resolver.staatsbibliothek-berlin.de/SBB0001A50400000000	1785	http://digital.staatsbibliothek-berlin.de/europeana/PPN828817367/00000005.tif	Staatsbibliothek zu Berlin - Preußischer Kulturbesitz	Donatius	Open Access	Habesci, Elias  Wittenberg, Albrecht: Der gegenwärtige Zustand des ottomanischen Reichs  worinn eine richtigere und unterhaltendere Nachricht von der Religion, der Regierung, dem Kriegswesen, den Sitten, Gewohnheiten und Zeitvertreiben der Türken, als in den bisher davon vorhandenen Schriften geliefert wird ; Nebst einer besondern Beschreibung des Hofes und Serail des Großherrn, und vielen besondern und angenehmen Anekdoten. Lübeck  Berlin 1785	Lübeck	Historische Drucke	Der gegenwärtige Zustand des ottomanischen Reichs	Monograph
PPN834941740	Harding, Arnoldus Joannes Fridericus  Böhmer, Philippus Ludovicus	Staatsbibliothek zu Berlin - Preußischer Kulturbesitz	1726	image/jpeg	http://resolver.staatsbibliothek-berlin.de/SBB0001B12E00000000	http://resolver.staatsbibliothek-berlin.de/SBB0001B12E00000000	1726	http://digital.staatsbibliothek-berlin.de/europeana/PPN834941740/00000001.tif	Staatsbibliothek zu Berlin - Preußischer Kulturbesitz	Bucholtius	Open Access	Harding, Arnoldus Joannes Fridericus  Böhmer, Philippus Ludovicus: Pivm Gratvlationis Officivm Viro Magnifico Et Svmme Venerabili Philippo Lvdovico Böhmer Sanctae Theologiae Doctori Celeberrimo Magnae Britanniae Regis Et Electoris Principis Brvnsvicensis Ac Lvnebvrgensis ... Ab Avgvstissimo Rege Clementissime Vocatvs Ad Ephoriae Generalis Ecclesiarvm Dvcatvs Lvnebvrgici Svscipiendam Provinciam Anno MDCCXXVI Mense Octobri Cellas Concederet Persolvtvm. Helmstadii  Berlin 1726	Helmstadii	Historische Drucke	Pivm Gratvlationis Officivm Viro Magnifico Et Svmme Venerabili Philippo Lvdovico Böhmer Sanctae Theologiae Doctori Celeberrimo Magnae Britanniae Regis Et Electoris Principis Brvnsvicensis Ac Lvnebvrgensis ... Ab Avgvstissimo Rege Clementissime Vocatvs Ad Ephoriae Generalis Ecclesiarvm Dvcatvs Lvnebvrgici Svscipiendam Provinciam Anno MDCCXXVI Mense Octobri Cellas Concederet Persolvtvm	Monograph
PPN828819327	Mullerus, Johannes Georgius  Kriegk, Georg Nicolaus	Staatsbibliothek zu Berlin - Preußischer Kulturbesitz	1707	image/jpeg	http://resolver.staatsbibliothek-berlin.de/SBB0001A50900000000	http://resolver.staatsbibliothek-berlin.de/SBB0001A50900000000	1707	http://digital.staatsbibliothek-berlin.de/europeana/PPN828819327/00000001.tif	Staatsbibliothek zu Berlin - Preußischer Kulturbesitz	Litteris Nisianis	Open Access	Mullerus, Johannes Georgius  Kriegk, Georg Nicolaus: Johannis Georgii Mvlleri Poes. Prof. Pvbl. Propempticon Ad Virvm Clarissimvm Ge. Nicolavm Kriegk Magistrvm Artivm Et Hactenvs Ordinis Philosophici Adivnctvm Meritissimvm Nvnc Gymnasii Ilfeldensis Rectorem Ac Instavratorem Amicvm Svvm  In Academia Ienensi, M D CC VII. Ienensi  Berlin 1707	Ienensi	Historische Drucke	Johannis Georgii Mvlleri Poes. Prof. Pvbl. Propempticon Ad Virvm Clarissimvm Ge. Nicolavm Kriegk Magistrvm Artivm Et Hactenvs Ordinis Philosophici Adivnctvm Meritissimvm Nvnc Gymnasii Ilfeldensis Rectorem Ac Instavratorem Amicvm Svvm	Monograph
PPN819810851	Piëter, Joachim	Staatsbibliothek zu Berlin - Preußischer Kulturbesitz	1775	image/jpeg	http://resolver.staatsbibliothek-berlin.de/SBB000194F500000000	http://resolver.staatsbibliothek-berlin.de/SBB000194F500000000	1775	http://digital.staatsbibliothek-berlin.de/europeana/PPN819810851/00000001.tif	Staatsbibliothek zu Berlin - Preußischer Kulturbesitz	Wange	Open Access	Piëter, Joachim: Homerici Carminis Laudes Ex Fontibus Graecorum Romanorumque Derivatae Rivulisque Recentiorum Diductae Vt Instar Commentarioli In Homerum Esse Possint. Berolini  Berlin 1775	Berolini	Historische Drucke	Homerici Carminis Laudes Ex Fontibus Graecorum Romanorumque Derivatae Rivulisque Recentiorum Diductae Vt Instar Commentarioli In Homerum Esse Possint	Monograph
PPN828829187	Callenberg, Johann Heinrich	Staatsbibliothek zu Berlin - Preußischer Kulturbesitz	1740	image/jpeg	http://resolver.staatsbibliothek-berlin.de/SBB0001A51100010000	http://resolver.staatsbibliothek-berlin.de/SBB0001A51100010000	1740	http://digital.staatsbibliothek-berlin.de/europeana/PPN828829187/00000001.tif	Staatsbibliothek zu Berlin - Preußischer Kulturbesitz	Institutum Judaicum	Open Access	Callenberg, Johann Heinrich: Loci Codicum Arabicorum De Jure Circa Christianos Muhammedico. Halae 1740	Halae	Historische Drucke	Loci Codicum Arabicorum De Jure Circa Christianos Muhammedico	Volume
PPN828829268	Callenberg, Johann Heinrich	Staatsbibliothek zu Berlin - Preußischer Kulturbesitz	1741	image/jpeg	http://resolver.staatsbibliothek-berlin.de/SBB0001A51100020000	http://resolver.staatsbibliothek-berlin.de/SBB0001A51100020000	1741	http://digital.staatsbibliothek-berlin.de/europeana/PPN828829268/00000001.tif	Staatsbibliothek zu Berlin - Preußischer Kulturbesitz	Institutum Judaicum	Open Access	Callenberg, Johann Heinrich: Loci Codicum Arabicorum De Jure Circa Christianos Muhammedico. Halae 1741	Halae	Historische Drucke	Loci Codicum Arabicorum De Jure Circa Christianos Muhammedico	Volume
PPN828671494	Bell, Johann  Ebeling, Christoph Daniel  Hunter, William	Staatsbibliothek zu Berlin - Preußischer Kulturbesitz	1787	image/jpeg	http://resolver.staatsbibliothek-berlin.de/SBB0001A4A100000000	http://resolver.staatsbibliothek-berlin.de/SBB0001A4A100000000	1787	http://digital.staatsbibliothek-berlin.de/europeana/PPN828671494/00000005.tif	Staatsbibliothek zu Berlin - Preußischer Kulturbesitz	Bohn	Open Access	Bell, Johann  Ebeling, Christoph Daniel  Hunter, William: Dr. Johann Bells Reisen von Petersburg in verschiedne Gegenden Asiens nach Persien, Sina u.s.w.  nebst desselben kurzer Nachricht von dem Zuge nach Derbent in Persien unter Peter dem Großen im Jahre 1722 ; Aus dem Englischen übersezt. Hamburg  Berlin 1787	Hamburg	Historische Drucke	Dr. Johann Bells Reisen von Petersburg in verschiedne Gegenden Asiens nach Persien, Sina u.s.w.	Monograph
PPN82776992X	Reinhold, Christian Ludolph	Staatsbibliothek zu Berlin - Preußischer Kulturbesitz	1791	image/jpeg	http://resolver.staatsbibliothek-berlin.de/SBB0001A23200000000	http://resolver.staatsbibliothek-berlin.de/SBB0001A23200000000	1791	http://digital.staatsbibliothek-berlin.de/europeana/PPN82776992X/00000005.tif	Staatsbibliothek zu Berlin - Preußischer Kulturbesitz	Perrenon	Open Access	Reinhold, Christian Ludolph: Beytrag einer Mythologie der alten teutschen Götter  Mit 7 Kupfern. Osnabrück  Münster  Berlin 1791	Osnabrück  Münster	Historische Drucke	Beytrag einer Mythologie der alten teutschen Götter	Monograph
PPN828830827	Callenberg, Johann Heinrich	Staatsbibliothek zu Berlin - Preußischer Kulturbesitz	1747	image/jpeg	http://resolver.staatsbibliothek-berlin.de/SBB0001A51100040000	http://resolver.staatsbibliothek-berlin.de/SBB0001A51100040000	1747	http://digital.staatsbibliothek-berlin.de/europeana/PPN828830827/00000001.tif	Staatsbibliothek zu Berlin - Preußischer Kulturbesitz	Institutum Judaicum	Open Access	Callenberg, Johann Heinrich: Loci Codicum Arabicorum De Jure Circa Christianos Muhammedico. Halae 1747	Halae	Historische Drucke	Loci Codicum Arabicorum De Jure Circa Christianos Muhammedico	Volume
PPN824414888	Comenius, Johann Amos  Dessler, Wolfgang Christoph	Staatsbibliothek zu Berlin - Preußischer Kulturbesitz	1754	image/jpeg	http://resolver.staatsbibliothek-berlin.de/SBB00019B6700010000	http://resolver.staatsbibliothek-berlin.de/SBB00019B6700010000	1754	http://digital.staatsbibliothek-berlin.de/europeana/PPN824414888/00000001.tif	Staatsbibliothek zu Berlin - Preußischer Kulturbesitz	Endter	Open Access	Comenius, Johann Amos  Dessler, Wolfgang Christoph: CL. Figuris instructa & illustrata, Cujus beneficio Tyronibus facillimâ methodo & summâ voluptate ingens elegantium Phrasium ac rarissimorum Terminorum Atrium in Prima Parte non extantium, copia instillari potest ...  Cum indice locupletissimo. Noribergae 1754	Noribergae	Historische Drucke	CL. Figuris instructa & illustrata, Cujus beneficio Tyronibus facillimâ methodo & summâ voluptate ingens elegantium Phrasium ac rarissimorum Terminorum Atrium in Prima Parte non extantium, copia instillari potest ...	Volume
PPN828819009	Salig, Christianus Augustus  Katte, Joannes Dethlevius  Nesenerus, Christophorus Fridericus	Staatsbibliothek zu Berlin - Preußischer Kulturbesitz	1707	image/jpeg	http://resolver.staatsbibliothek-berlin.de/SBB0001A50800000000	http://resolver.staatsbibliothek-berlin.de/SBB0001A50800000000	1707	http://digital.staatsbibliothek-berlin.de/europeana/PPN828819009/00000001.tif	Staatsbibliothek zu Berlin - Preußischer Kulturbesitz	Müllerus	Open Access	Salig, Christianus Augustus  Katte, Joannes Dethlevius  Nesenerus, Christophorus Fridericus: Carmen Propempticum, Quo Nobilissimos Ornatissimosque Iuvenes, Jo. Dethlevium De Katte, Bremensem Equitem, Et Christoph. Frider. Nesenerum, Sambswegiensem, Coniunctissimos Antea Commilitones Suos, Ex Bergensi Lyceo In Illustrem Fridericianam A.O.R. MD CCVII Abeuntes, Prosequi Voluit. Magdeburgi  Berlin 1707	Magdeburgi	Historische Drucke	Carmen Propempticum, Quo Nobilissimos Ornatissimosque Iuvenes, Jo. Dethlevium De Katte, Bremensem Equitem, Et Christoph. Frider. Nesenerum, Sambswegiensem, Coniunctissimos Antea Commilitones Suos, Ex Bergensi Lyceo In Illustrem Fridericianam A.O.R. MD CCVII Abeuntes, Prosequi Voluit	Monograph
PPN82882861X	Callenberg, Johann Heinrich	Staatsbibliothek zu Berlin - Preußischer Kulturbesitz	1740	image/jpeg	http://resolver.staatsbibliothek-berlin.de/SBB0001A51100000000	http://resolver.staatsbibliothek-berlin.de/SBB0001A51100000000	1740	None	Staatsbibliothek zu Berlin - Preußischer Kulturbesitz	Institutum Judaicum	Open Access	Callenberg, Johann Heinrich: Loci Codicum Arabicorum De Jure Circa Christianos Muhammedico. Halae  Berlin 1740	Halae	Historische Drucke	Loci Codicum Arabicorum De Jure Circa Christianos Muhammedico	Multivolume work
PPN824414756	Comenius, Johannes Amos	Staatsbibliothek zu Berlin - Preußischer Kulturbesitz	1756	image/jpeg	http://resolver.staatsbibliothek-berlin.de/SBB00019B6700000000	http://resolver.staatsbibliothek-berlin.de/SBB00019B6700000000	1756	None	Staatsbibliothek zu Berlin - Preußischer Kulturbesitz	Endt[er]	Open Access	Comenius, Johannes Amos: Joh. Amos Comenii Orbis Sensualium Picti Pars .... Noribergae  Berlin 1756	Noribergae	Historische Drucke	Joh. Amos Comenii Orbis Sensualium Picti Pars ...	Multivolume work
PPN828818134	Kiefhaber, Michael Volkmar  Omeis, Magnus Daniel	Staatsbibliothek zu Berlin - Preußischer Kulturbesitz	1706	image/jpeg	http://resolver.staatsbibliothek-berlin.de/SBB0001A50600000000	http://resolver.staatsbibliothek-berlin.de/SBB0001A50600000000	1706	http://digital.staatsbibliothek-berlin.de/europeana/PPN828818134/00000005.tif	Staatsbibliothek zu Berlin - Preußischer Kulturbesitz	Hagen	Open Access	Kiefhaber, Michael Volkmar  Omeis, Magnus Daniel: Dem Hoch-Edel, Gestreng- und Hochgelehrten Herrn Magnus Daniel Omeisen, Comiti Palatino Caesareo, Phil. Moralis & Eloquentiae Professori Publico Und der Hochlöblichen Philosophischen Facultaet auf der weitberühmten Universitaet Altdorff, der Zeit Hochansehnlichem Decano, wolte mit diesen Zeilen seinen schuldigsten Gehorsam zu erkennen geben Michael Volkmar Kiefhaber. Schwobach  Berlin 1706	Schwobach	Historische Drucke	Dem Hoch-Edel, Gestreng- und Hochgelehrten Herrn Magnus Daniel Omeisen, Comiti Palatino Caesareo, Phil. Moralis & Eloquentiae Professori Publico Und der Hochlöblichen Philosophischen Facultaet auf der weitberühmten Universitaet Altdorff, der Zeit Hochansehnlichem Decano, wolte mit diesen Zeilen seinen schuldigsten Gehorsam zu erkennen geben Michael Volkmar Kiefhaber	Monograph
PPN828829349	Callenberg, Johann Heinrich	Staatsbibliothek zu Berlin - Preußischer Kulturbesitz	1741	image/jpeg	http://resolver.staatsbibliothek-berlin.de/SBB0001A51100030000	http://resolver.staatsbibliothek-berlin.de/SBB0001A51100030000	1741	http://digital.staatsbibliothek-berlin.de/europeana/PPN828829349/00000001.tif	Staatsbibliothek zu Berlin - Preußischer Kulturbesitz	Institutum Judaicum	Open Access	Callenberg, Johann Heinrich: Loci Codicum Arabicorum De Jure Circa Christianos Muhammedico. Halae 1741	Halae	Historische Drucke	Loci Codicum Arabicorum De Jure Circa Christianos Muhammedico	Volume
PPN83303278X	Rogall, Georg Friedrich	Staatsbibliothek zu Berlin - Preußischer Kulturbesitz	1738	image/jpeg	http://resolver.staatsbibliothek-berlin.de/SBB0001AC9300000000	http://resolver.staatsbibliothek-berlin.de/SBB0001AC9300000000	1738	http://digital.staatsbibliothek-berlin.de/europeana/PPN83303278X/00000005.tif	Staatsbibliothek zu Berlin - Preußischer Kulturbesitz	Züllichauisches Wäysenhaus  Frommann	Open Access	Rogall, Georg Friedrich: Georg Friedrich Rogalls, S. Theol. Doct. und Prof. Ord. auf der Academie zu Königsb. in Preussen, Hertzliches Erweckungs-Schreiben, An einige Studios. Theol. auf der Academie zu Halle den 13. Dec. 1729. abgelassen  Zur allgemeinen Erbauung, sonderlich derer, die sich zum Dienst der Kirchen Gottes zubereiten, durch den Druck mitgetheilet. Leipzig  Leipzig  Berlin 1738	Leipzig  Leipzig	Historische Drucke	Georg Friedrich Rogalls, S. Theol. Doct. und Prof. Ord. auf der Academie zu Königsb. in Preussen, Hertzliches Erweckungs-Schreiben, An einige Studios. Theol. auf der Academie zu Halle den 13. Dec. 1729. abgelassen	Monograph
PPN829081569	Nemeitz, Joachim Christoph  Stenbock, Magnus	Staatsbibliothek zu Berlin - Preußischer Kulturbesitz	1721	image/jpeg	http://resolver.staatsbibliothek-berlin.de/SBB0001A5F700000000	http://resolver.staatsbibliothek-berlin.de/SBB0001A5F700000000	1721	http://digital.staatsbibliothek-berlin.de/europeana/PPN829081569/00000009.tif	Staatsbibliothek zu Berlin - Preußischer Kulturbesitz	None	Open Access	Nemeitz, Joachim Christoph  Stenbock, Magnus: Mémoires Concernant M. Le Comte de Steenbock Senateur De Suede Et Generalissime Des Armées De Sa Majesté Sued. En Allemagne Savoir les Canpagnes de 1712. & 1713. de ce Général aved sa Justification. [S.l.]  Berlin 1721	[S.l.]	Historische Drucke	Mémoires Concernant M. Le Comte de Steenbock Senateur De Suede Et Generalissime Des Armées De Sa Majesté Sued. En Allemagne Savoir les Canpagnes de 1712. & 1713. de ce Général aved sa Justification	Monograph
PPN833149326	Crusius, Christian August  Walther, Rudolph Julius	Staatsbibliothek zu Berlin - Preußischer Kulturbesitz	1767	image/jpeg	http://resolver.staatsbibliothek-berlin.de/SBB0001ACCB00000000	http://resolver.staatsbibliothek-berlin.de/SBB0001ACCB00000000	1767	http://digital.staatsbibliothek-berlin.de/europeana/PPN833149326/00000007.tif	Staatsbibliothek zu Berlin - Preußischer Kulturbesitz	Langenheim	Open Access	Crusius, Christian August  Walther, Rudolph Julius: Herrn D. Christian August Crusius, Professoris Primarii zu Leipzig, des Hochstifts Meissen Prälaten und Domherrn [et]c. [et]c. Abhandlung von der wahren Bedeutung des Nahmens Jehovah, daß sie sich auf ein Werk Gottes, und zwar auf das Reich Gottes, beziehe. Leipzig  Berlin 1767	Leipzig	Historische Drucke	Herrn D. Christian August Crusius, Professoris Primarii zu Leipzig, des Hochstifts Meissen Prälaten und Domherrn [et]c. [et]c. Abhandlung von der wahren Bedeutung des Nahmens Jehovah, daß sie sich auf ein Werk Gottes, und zwar auf das Reich Gottes, beziehe	Monograph
PPN83302955X	Le Noble, Eustache	Staatsbibliothek zu Berlin - Preußischer Kulturbesitz	1748	image/jpeg	http://resolver.staatsbibliothek-berlin.de/SBB0001AC9100000000	http://resolver.staatsbibliothek-berlin.de/SBB0001AC9100000000	1748	http://digital.staatsbibliothek-berlin.de/europeana/PPN83302955X/00000005.tif	Staatsbibliothek zu Berlin - Preußischer Kulturbesitz	Hartmann	Open Access	Le Noble, Eustache: Der Eckel vor der Welt, durch lehrreiche Sprüche, so aus der heiligen Schrift und aus den Kirchenvätern gezogen. Dantzig  Berlin 1748	Dantzig	Historische Drucke	Der Eckel vor der Welt, durch lehrreiche Sprüche, so aus der heiligen Schrift und aus den Kirchenvätern gezogen	Monograph
PPN828411549	Meineke, Johann Heinrich Friedrich	Staatsbibliothek zu Berlin - Preußischer Kulturbesitz	1791	image/jpeg	http://resolver.staatsbibliothek-berlin.de/SBB0001A3A900000000	http://resolver.staatsbibliothek-berlin.de/SBB0001A3A900000000	1791	http://digital.staatsbibliothek-berlin.de/europeana/PPN828411549/00000005.tif	Staatsbibliothek zu Berlin - Preußischer Kulturbesitz	Ernst	Open Access	Meineke, Johann Heinrich Friedrich: Paläphatus von unglaublichen Begebenheiten  Aus dem Griechischen übersetzt, und mit Anmerkungen erläutert. Ouedlinburg  Berlin 1791	Ouedlinburg	Historische Drucke	Paläphatus von unglaublichen Begebenheiten	Monograph
PPN825725542	Reuchlinus, Joannes  Hardt, Anton Julius  Tunicius, Antonius  Dalburgius, Joannes  Basellius, Nicolaus	Staatsbibliothek zu Berlin - Preußischer Kulturbesitz	1729	image/jpeg	http://resolver.staatsbibliothek-berlin.de/SBB00019CE100000000	http://resolver.staatsbibliothek-berlin.de/SBB00019CE100000000	1729	http://digital.staatsbibliothek-berlin.de/europeana/PPN825725542/00000001.tif	Staatsbibliothek zu Berlin - Preußischer Kulturbesitz	Schnorrius	Open Access	Reuchlinus, Joannes  Hardt, Anton Julius  Tunicius, Antonius  Dalburgius, Joannes  Basellius, Nicolaus: Ineditvm Joannis Revchlini, Phorcensis Svevi, J. V. D. Tvbingensis, Primi Secvlo XV. Apvd Germanos Græcæ Lingvæ Instavratoris, Colloqvivm Græco-Latinvm, Anno 1489. Stvtgardiæ Concinnatvm Et Episcopo Wormatiensi, Joanni Dalbvrgio, Elegantiorvm Literarvm Ævo Illo Præsidi, Missvm. Ex MSCo. A. 1508. A Nicolao Basellio Monacho Hirsavgiensi Exarato, In Elegantivm Brvnsvicensivm Scholarvm Græca Stvdia Solide Et Cvrate Colentivm Oblectationem A. MDCCXXIX. In Academia Jvlia. Helmstadii  Berlin 1729	Helmstadii	Historische Drucke	Ineditvm Joannis Revchlini, Phorcensis Svevi, J. V. D. Tvbingensis, Primi Secvlo XV. Apvd Germanos Græcæ Lingvæ Instavratoris, Colloqvivm Græco-Latinvm, Anno 1489. Stvtgardiæ Concinnatvm Et Episcopo Wormatiensi, Joanni Dalbvrgio, Elegantiorvm Literarvm Ævo Illo Præsidi, Missvm. Ex MSCo. A. 1508. A Nicolao Basellio Monacho Hirsavgiensi Exarato, In Elegantivm Brvnsvicensivm Scholarvm Græca Stvdia Solide Et Cvrate Colentivm Oblectationem A. MDCCXXIX. In Academia Jvlia	Monograph
