PPN	creator	dataProvider	date	format	identifier	isShownAt	issued	object	provider	publisher	rights	source	spatial	subject	title	type
PPN835132021	Fabricius, Erich Johann  Guericke, Otto	Staatsbibliothek zu Berlin - Preußischer Kulturbesitz	1704	image/jpeg	http://resolver.staatsbibliothek-berlin.de/SBB0001B1EF00000000	http://resolver.staatsbibliothek-berlin.de/SBB0001B1EF00000000	1704	http://digital.staatsbibliothek-berlin.de/europeana/PPN835132021/00000001.tif	Staatsbibliothek zu Berlin - Preußischer Kulturbesitz	Wiering	Open Access	Fabricius, Erich Johann  Guericke, Otto: Trauer- und Trost-Gedancken, Welche über den wohlseelig genommenen Abschied des ... Herrn Otto von Guericken ... Als selbiger den 26 Januarii ... 1704 ... sanfft und seelig in dem Herrn entschlaffen, Und darauff Den 27sten Martii nacher Magdeburg zu seiner Hoch-Adelichen Ruhestätt abgeführet ward. Dem betrübten hinterbliebenen hohen Hause unterthänigst eröffnen wollen Erich Johann Fabricius. Hamburg  Berlin 1704	Hamburg	Historische Drucke	Trauer- und Trost-Gedancken, Welche über den wohlseelig genommenen Abschied des ... Herrn Otto von Guericken ... Als selbiger den 26 Januarii ... 1704 ... sanfft und seelig in dem Herrn entschlaffen, Und darauff Den 27sten Martii nacher Magdeburg zu seiner Hoch-Adelichen Ruhestätt abgeführet ward. Dem betrübten hinterbliebenen hohen Hause unterthänigst eröffnen wollen Erich Johann Fabricius	Monograph
PPN835298752	Cramer, Johann Andreas  Weiße, Christian Felix  Denis, Michael  Mastalier, Carl  Gellert, Christian Fürchtegott	Staatsbibliothek zu Berlin - Preußischer Kulturbesitz	1774	image/jpeg	http://resolver.staatsbibliothek-berlin.de/SBB0001B25C00000000	http://resolver.staatsbibliothek-berlin.de/SBB0001B25C00000000	1774	http://digital.staatsbibliothek-berlin.de/europeana/PPN835298752/00000009.tif	Staatsbibliothek zu Berlin - Preußischer Kulturbesitz	Weidmann und Reich	Open Access	Cramer, Johann Andreas  Weiße, Christian Felix  Denis, Michael  Mastalier, Carl  Gellert, Christian Fürchtegott: Christian Fürchtegott Gellerts Leben. Leipzig  Berlin 1774	Leipzig	Historische Drucke	Christian Fürchtegott Gellerts Leben	Monograph
PPN835095150	Guericke, Otto	Staatsbibliothek zu Berlin - Preußischer Kulturbesitz	1704	image/jpeg	http://resolver.staatsbibliothek-berlin.de/SBB0001B1D100000000	http://resolver.staatsbibliothek-berlin.de/SBB0001B1D100000000	1704	http://digital.staatsbibliothek-berlin.de/europeana/PPN835095150/00000005.tif	Staatsbibliothek zu Berlin - Preußischer Kulturbesitz	Wiering	Open Access	Guericke, Otto: Christ-Adeliches Ehren-Gedächtniß und Lebens-Lauff des ... Herrn Otto von Guericken, I. Königl. M. in Preussen Hochbetrauten Geheimbten Rahts und im Nieder-Sächsischen Cräyse verordneten Residenten. auch Wegen dessen schmertzhafften Absterben abgefassete Klag- und Trost-Gedancken, Als derselbe den 26 Januarii 1704 ... im 76sten Jahr ... sanfft und seelig entschlaffen, und dessen verblichener Cörper den 27 Martii darauff nachher Magdeburg in das ihme zukommende Erb-Begräbniß zu St. Johannis daselbsten abgeführet worden. Hamburg  Berlin 1704	Hamburg	Historische Drucke	Christ-Adeliches Ehren-Gedächtniß und Lebens-Lauff des ... Herrn Otto von Guericken, I. Königl. M. in Preussen Hochbetrauten Geheimbten Rahts und im Nieder-Sächsischen Cräyse verordneten Residenten. auch Wegen dessen schmertzhafften Absterben abgefassete Klag- und Trost-Gedancken, Als derselbe den 26 Januarii 1704 ... im 76sten Jahr ... sanfft und seelig entschlaffen, und dessen verblichener Cörper den 27 Martii darauff nachher Magdeburg in das ihme zukommende Erb-Begräbniß zu St. Johannis daselbsten abgeführet worden	Monograph
PPN826913628	None	Staatsbibliothek zu Berlin - Preußischer Kulturbesitz	1788	image/jpeg	http://resolver.staatsbibliothek-berlin.de/SBB0001A06100000000	http://resolver.staatsbibliothek-berlin.de/SBB0001A06100000000	1788	http://digital.staatsbibliothek-berlin.de/europeana/PPN826913628/00000005.tif	Staatsbibliothek zu Berlin - Preußischer Kulturbesitz	None	Open Access	Ein Wort im Vertrauen über den Türkenkrieg. [S.l.]  Berlin 1788	[S.l.]	Historische Drucke	Ein Wort im Vertrauen über den Türkenkrieg	Monograph
PPN835147134	Römer, Carl Heinrich	Staatsbibliothek zu Berlin - Preußischer Kulturbesitz	1791	image/jpeg	http://resolver.staatsbibliothek-berlin.de/SBB0001B20500000000	http://resolver.staatsbibliothek-berlin.de/SBB0001B20500000000	1791	http://digital.staatsbibliothek-berlin.de/europeana/PPN835147134/00000003.tif	Staatsbibliothek zu Berlin - Preußischer Kulturbesitz	Kühne	Open Access	Römer, Carl Heinrich: Das Recht der Fürsten über die Religion ihrer Unterthanen  aus verschiedenen Gesichtspunkten geprüft. Wittenberg  Berlin 1791	Wittenberg	Historische Drucke	Das Recht der Fürsten über die Religion ihrer Unterthanen	Monograph
PPN837257506	Göthe, Johann Wolfgang	Staatsbibliothek zu Berlin - Preußischer Kulturbesitz	1776	image/jpeg	http://resolver.staatsbibliothek-berlin.de/SBB0001B58700000000	http://resolver.staatsbibliothek-berlin.de/SBB0001B58700000000	1776	http://digital.staatsbibliothek-berlin.de/europeana/PPN837257506/00000001.tif	Staatsbibliothek zu Berlin - Preußischer Kulturbesitz	None	Open Access	Göthe, Johann Wolfgang: Stella  Ein Schauspiel für Liebende in fünf Akten. Schafhausen  Berlin 1776	Schafhausen	Historische Drucke	Stella	Monograph
PPN835133222	Guericke, Otto von	Staatsbibliothek zu Berlin - Preußischer Kulturbesitz	1704	image/jpeg	http://resolver.staatsbibliothek-berlin.de/SBB0001B1F000000000	http://resolver.staatsbibliothek-berlin.de/SBB0001B1F000000000	1704	http://digital.staatsbibliothek-berlin.de/europeana/PPN835133222/00000001.tif	Staatsbibliothek zu Berlin - Preußischer Kulturbesitz	Wiering	Open Access	Guericke, Otto von: Trauer- und Gedächtniß-Ode Uber den schmertzlichen doch wohlseeligen Hintritt aus dieser Welt des ... Herrn Otto von Guericken ... 1704 ... durch einen sanfft und seeligen Todt diese Zeitlichkeit gesegnete, und der Seelen nach in die ewige Freude versetzet wurde. Hamburg  Berlin 1704	Hamburg	Historische Drucke	Trauer- und Gedächtniß-Ode Uber den schmertzlichen doch wohlseeligen Hintritt aus dieser Welt des ... Herrn Otto von Guericken ... 1704 ... durch einen sanfft und seeligen Todt diese Zeitlichkeit gesegnete, und der Seelen nach in die ewige Freude versetzet wurde	Monograph
PPN835865916	Floerke, Friedrich Jakob	Staatsbibliothek zu Berlin - Preußischer Kulturbesitz	1798	image/jpeg	http://resolver.staatsbibliothek-berlin.de/SBB0001B35A00000000	http://resolver.staatsbibliothek-berlin.de/SBB0001B35A00000000	1798	http://digital.staatsbibliothek-berlin.de/europeana/PPN835865916/00000007.tif	Staatsbibliothek zu Berlin - Preußischer Kulturbesitz	Pauli	Open Access	Floerke, Friedrich Jakob: Die Leidenschaften der Menschen und Thiere  ihrer Entstehung, Dauer, Ende oder Verwandlung nach, wie auch nach den verschiedenen Temperamenten und Menschenracen, deren Lage, Zeit und Umständen, im LXXV. Th. der ökonomisch-technologischen Encyklopädie, beurtheilet und abgehandelt ; Zur Lehre, Nutzen und Vergnügen, im Fache der Menschenkenntniß für alle Stände... ; Mit 10 1/4 Bogen Kupfern. Berlin  Berlin 1798	Berlin	Historische Drucke	Die Leidenschaften der Menschen und Thiere	Monograph
PPN836712811	Reimmann, Jakob Friderich  Albrecht, Johann Peter	Staatsbibliothek zu Berlin - Preußischer Kulturbesitz	1724	image/jpeg	http://resolver.staatsbibliothek-berlin.de/SBB0001B53600000000	http://resolver.staatsbibliothek-berlin.de/SBB0001B53600000000	1724	http://digital.staatsbibliothek-berlin.de/europeana/PPN836712811/00000001.tif	Staatsbibliothek zu Berlin - Preußischer Kulturbesitz	Geißmar	Open Access	Reimmann, Jakob Friderich  Albrecht, Johann Peter: Zwey Fustapffen zweyer göttlichen Herrlichkeiten, Nemlich, Der allgemeinen Göttlichen Herrschafft und Heil-Krafft  Welche Nach dem Inhalt der auserlesenen Worte Exod. XV. vers. 26. ...  Bey Hochansehnlicher Beerdigung Des ... Herrn Johann Peter Albrecht, Der Artzney Hocherfahrnen Doctoris ... Als Derselbe A.C. 1724. den 16. Decembris in dem 74sten Jahr seines Alters ... entschlaffen, und die zurückgebliebene Gebeine den 22sten ejusdem ... in die ihnen zubereitete Kammer eingeschlossen worden, Der gesam[m]ten vornehmen Leyd-tragenden Familie ... gezeiget .... Hildesheim  Berlin 1724	Hildesheim	Historische Drucke	Zwey Fustapffen zweyer göttlichen Herrlichkeiten, Nemlich, Der allgemeinen Göttlichen Herrschafft und Heil-Krafft  Welche Nach dem Inhalt der auserlesenen Worte Exod. XV. vers. 26. ...  Bey Hochansehnlicher Beerdigung Des ... Herrn Johann Peter Albrecht, Der Artzney Hocherfahrnen Doctoris ... Als Derselbe A.C. 1724. den 16. Decembris in dem 74sten Jahr seines Alters ... entschlaffen, und die zurückgebliebene Gebeine den 22sten ejusdem ... in die ihnen zubereitete Kammer eingeschlossen worden, Der gesam[m]ten vornehmen Leyd-tragenden Familie ... gezeiget ...	Monograph
PPN836712943	Reimmann, Jakob Friderich  Albrecht, Johann Peter	Staatsbibliothek zu Berlin - Preußischer Kulturbesitz	1724	image/jpeg	http://resolver.staatsbibliothek-berlin.de/SBB0001B53600010000	http://resolver.staatsbibliothek-berlin.de/SBB0001B53600010000	1724	None	Staatsbibliothek zu Berlin - Preußischer Kulturbesitz	Geißmar	Open Access	Reimmann, Jakob Friderich  Albrecht, Johann Peter: Die Bey hohen Gaben erkannte Christliche Demuht. Hildesheim 1724	Hildesheim	Historische Drucke	Die Bey hohen Gaben erkannte Christliche Demuht	Other
PPN836444892	Elswich, Johann Hermann  Diecmannus, Johannes	Staatsbibliothek zu Berlin - Preußischer Kulturbesitz	1720	image/jpeg	http://resolver.staatsbibliothek-berlin.de/SBB0001B50D00000000	http://resolver.staatsbibliothek-berlin.de/SBB0001B50D00000000	1720	http://digital.staatsbibliothek-berlin.de/europeana/PPN836444892/00000001.tif	Staatsbibliothek zu Berlin - Preußischer Kulturbesitz	Jani	Open Access	Elswich, Johann Hermann  Diecmannus, Johannes: Der Im Tode getroste Muth eines gerechten Theologi  ward bei ... Leichen-Bestattung Des ... Hrn. Johannis Diecmanni, der Heil. Schrifft Hochberühmten Doctoris ... wie auch Hochverordneten Consistorial-Raths, Aus denen Worten des XXVII. Psalms ... Anno 1720. den 19. Julii In der Cosmæ und Damiani Kirchen in Stade. Bremen  Berlin 1720	Bremen	Historische Drucke	Der Im Tode getroste Muth eines gerechten Theologi	Monograph
PPN836321359	Sachse, Lebrecht Wilhelm  Wortmann, Friederich  Pfau, Wolffgang Eberhard  Thülmeyer, Friederich Wilhelm  Thülmeier, Wilhelm Friederich	Staatsbibliothek zu Berlin - Preußischer Kulturbesitz	1708	image/jpeg	http://resolver.staatsbibliothek-berlin.de/SBB0001B4F100000000	http://resolver.staatsbibliothek-berlin.de/SBB0001B4F100000000	1708	http://digital.staatsbibliothek-berlin.de/europeana/PPN836321359/00000001.tif	Staatsbibliothek zu Berlin - Preußischer Kulturbesitz	Müller	Open Access	Sachse, Lebrecht Wilhelm  Wortmann, Friederich  Pfau, Wolffgang Eberhard  Thülmeyer, Friederich Wilhelm  Thülmeier, Wilhelm Friederich: Klag- und Trost-Gedichte, Worin Das Schmertz-bringende, doch Selige Absterben Des ... Herrn Wilhelm Friederich Thülmeiers, Königl. Preußischen Hoff-Predigers Und Ersten Predigers der Deutschen Reformierten Gemeinde in Magdeburg, Als ihres Wehrt-geschätzten Herrn Bruders, Freundes und Vaters, Da Derselbe den 5. Dec. Anno 1708. ... entschlieff, und den 9. darauf ... beerdiget ward, schmertzlich beklagen, und die Hochbetrübte Frau Wittwe, wie auch Sich selbst aufrichten Nachbenahmte Leyd-tragende. Magdeburg  Berlin 1708	Magdeburg	Historische Drucke	Klag- und Trost-Gedichte, Worin Das Schmertz-bringende, doch Selige Absterben Des ... Herrn Wilhelm Friederich Thülmeiers, Königl. Preußischen Hoff-Predigers Und Ersten Predigers der Deutschen Reformierten Gemeinde in Magdeburg, Als ihres Wehrt-geschätzten Herrn Bruders, Freundes und Vaters, Da Derselbe den 5. Dec. Anno 1708. ... entschlieff, und den 9. darauf ... beerdiget ward, schmertzlich beklagen, und die Hochbetrübte Frau Wittwe, wie auch Sich selbst aufrichten Nachbenahmte Leyd-tragende	Monograph
PPN83632742X	Kirchhof, Albertus Christianus  Scheel, Martinus  Eßmarch, Nicolaus Ludovicus  Clauer, Matthias Jacob  Staemmen, J.  Schröder, Titus  Bock, Joh. Georg.  Stemann, Just. Val.  Stemann, I. F.  Petkum, Johann Hieronymus	Staatsbibliothek zu Berlin - Preußischer Kulturbesitz	1715	image/jpeg	http://resolver.staatsbibliothek-berlin.de/SBB0001B4F500000000	http://resolver.staatsbibliothek-berlin.de/SBB0001B4F500000000	1715	http://digital.staatsbibliothek-berlin.de/europeana/PPN83632742X/00000001.tif	Staatsbibliothek zu Berlin - Preußischer Kulturbesitz	Lehmann	Open Access	Kirchhof, Albertus Christianus  Scheel, Martinus  Eßmarch, Nicolaus Ludovicus  Clauer, Matthias Jacob  Staemmen, J.  Schröder, Titus  Bock, Joh. Georg.  Stemann, Just. Val.  Stemann, I. F.  Petkum, Johann Hieronymus: Der Lohn der treuen Knechte Gottes  Bey Hochansehnlicher Leichbestätigung Des Weyland ... Herrn Johannis Hieronymi von Petkum, SS. Theologiæ Licentiati, Ihrer Königl. Maj. zu Dennemarck Norwegen [et]c. ... Præpositi des Münsterdorffischen Consistorii, und der Kirchen St. Laurentii in Itzehoe Pastoris Primarii ; Als Derselbe am 1. Heil. Weynacht Feyertage des 1713ten Jahrs ... verschieden, dessen entseelter Körper aber am 20. Mart. des 1714. Jahrs zu seiner Ruhe in gedachter Kirchen begleitet wurde. Glückstadt  Berlin 1715	Glückstadt	Historische Drucke	Der Lohn der treuen Knechte Gottes	Monograph
PPN836719557	Kirchhof, Albertus Christianus  Scheel, Martinus  Eßmarch, Nicolaus Ludovicus  Clauer, Matthias Jacob  Staemmen, J.  Schröder, Titus  Bock, Joh. Georg.  Stemann, Just. Val.  Stemann, I. F.  Petkum, Johann Hieronymus	Staatsbibliothek zu Berlin - Preußischer Kulturbesitz	1715	image/jpeg	http://resolver.staatsbibliothek-berlin.de/SBB0001B4F500010000	http://resolver.staatsbibliothek-berlin.de/SBB0001B4F500010000	1715	None	Staatsbibliothek zu Berlin - Preußischer Kulturbesitz	None	Open Access	Kirchhof, Albertus Christianus  Scheel, Martinus  Eßmarch, Nicolaus Ludovicus  Clauer, Matthias Jacob  Staemmen, J.  Schröder, Titus  Bock, Joh. Georg.  Stemann, Just. Val.  Stemann, I. F.  Petkum, Johann Hieronymus: Als ein Getreuer Bottschaffter Gottes, Der Hoch-Ehrwürdige ... Herr Johannes Hieronymus von Petkum, S.S. Theol. Licentiatus und Hoch-verdienter Præpositus und Pastor zu Itzehoe, Eben am Tage guter Bottschafft, als dem ersten Weinachts-Feyertage Anno 1713. ... Seinen Geist ... in die Hände seines Erlösers übergeben ... Wolte diesem Seinen ... Gönner und Freunde, auch Successori in dem Heiligen Ampte zu Itzehoe, Die behörige Schuldigkeit Zu Seinem wohl-verdienten Nachruhm ... zu Tage legen, D. Johannes Volckmar, Past. Cathar. Rev. Minist. Hamburg. Senior. Glückstadt 1715	Glückstadt	Historische Drucke	Als ein Getreuer Bottschaffter Gottes, Der Hoch-Ehrwürdige ... Herr Johannes Hieronymus von Petkum, S.S. Theol. Licentiatus und Hoch-verdienter Præpositus und Pastor zu Itzehoe, Eben am Tage guter Bottschafft, als dem ersten Weinachts-Feyertage Anno 1713. ... Seinen Geist ... in die Hände seines Erlösers übergeben ... Wolte diesem Seinen ... Gönner und Freunde, auch Successori in dem Heiligen Ampte zu Itzehoe, Die behörige Schuldigkeit Zu Seinem wohl-verdienten Nachruhm ... zu Tage legen, D. Johannes Volckmar, Past. Cathar. Rev. Minist. Hamburg. Senior	Other
PPN836719573	Kirchhof, Albertus Christianus  Scheel, Martinus  Eßmarch, Nicolaus Ludovicus  Clauer, Matthias Jacob  Staemmen, J.  Schröder, Titus  Bock, Joh. Georg.  Stemann, Just. Val.  Stemann, I. F.  Petkum, Johann Hieronymus	Staatsbibliothek zu Berlin - Preußischer Kulturbesitz	1715	image/jpeg	http://resolver.staatsbibliothek-berlin.de/SBB0001B4F500020000	http://resolver.staatsbibliothek-berlin.de/SBB0001B4F500020000	1715	None	Staatsbibliothek zu Berlin - Preußischer Kulturbesitz	None	Open Access	Kirchhof, Albertus Christianus  Scheel, Martinus  Eßmarch, Nicolaus Ludovicus  Clauer, Matthias Jacob  Staemmen, J.  Schröder, Titus  Bock, Joh. Georg.  Stemann, Just. Val.  Stemann, I. F.  Petkum, Johann Hieronymus: Perennaturæ Memoriae Viri Maxime Venerabilis, Amplissimi, Atque Doctissimi Domini Johannis Hieronymi â Petkum, SS. Theol. Licentiati ... Ecclesiæ Coenobialis Itzehoensis Pastoris Primarii ... In Ipsis Sacris Natalitiis An. MDCC XIII. ... Morte Functi .... [S.l.] 1715	[S.l.]	Historische Drucke	Perennaturæ Memoriae Viri Maxime Venerabilis, Amplissimi, Atque Doctissimi Domini Johannis Hieronymi â Petkum, SS. Theol. Licentiati ... Ecclesiæ Coenobialis Itzehoensis Pastoris Primarii ... In Ipsis Sacris Natalitiis An. MDCC XIII. ... Morte Functi ...	Other
PPN836719638	Kirchhof, Albertus Christianus  Scheel, Martinus  Eßmarch, Nicolaus Ludovicus  Clauer, Matthias Jacob  Staemmen, J.  Schröder, Titus  Bock, Joh. Georg.  Stemann, Just. Val.  Stemann, I. F.  Petkum, Johann Hieronymus	Staatsbibliothek zu Berlin - Preußischer Kulturbesitz	1715	image/jpeg	http://resolver.staatsbibliothek-berlin.de/SBB0001B4F500030000	http://resolver.staatsbibliothek-berlin.de/SBB0001B4F500030000	1715	None	Staatsbibliothek zu Berlin - Preußischer Kulturbesitz	None	Open Access	Kirchhof, Albertus Christianus  Scheel, Martinus  Eßmarch, Nicolaus Ludovicus  Clauer, Matthias Jacob  Staemmen, J.  Schröder, Titus  Bock, Joh. Georg.  Stemann, Just. Val.  Stemann, I. F.  Petkum, Johann Hieronymus: Letzte Pflicht, Uber der Leichen Des Weyland  ... Hochgelahrten Herrn, Herrn Johann Hieronymi von Petkum, Der Heiligen Schrifft ... Licentiati, Hochansehnlichen Præpositi des ... Münsterdorfischen Consistorii, wie auch ... Pastoris primarii zu St. Laurentii Kirche in Itzehoe, Seinem Lieb-Wehrtesten Gönner Zu schuldigster Ehre Am Tage seiner Beerdigung war der 20. Martii 1714. ... abgeleget. Glückstadt 1715	Glückstadt	Historische Drucke	Letzte Pflicht, Uber der Leichen Des Weyland	Other
PPN836314069	Beckmann, Johann Christoff  Stockhausen, Antonius Ulricus  Roth, Heinrich Wilhelm  Müllerus, Burchardus  Ulrich, Daniel  Hertzog, Georgius  Cöper, H. H.  Lehmann, I. L.  Rumpff, Johann Wilhelm  Hertzog, Wilhelm  Voigt, Gottlieb Christian  Thülmeier, Wilhelm Friederich	Staatsbibliothek zu Berlin - Preußischer Kulturbesitz	1708	image/jpeg	http://resolver.staatsbibliothek-berlin.de/SBB0001B4EC00000000	http://resolver.staatsbibliothek-berlin.de/SBB0001B4EC00000000	1708	http://digital.staatsbibliothek-berlin.de/europeana/PPN836314069/00000005.tif	Staatsbibliothek zu Berlin - Preußischer Kulturbesitz	Müller	Open Access	Beckmann, Johann Christoff  Stockhausen, Antonius Ulricus  Roth, Heinrich Wilhelm  Müllerus, Burchardus  Ulrich, Daniel  Hertzog, Georgius  Cöper, H. H.  Lehmann, I. L.  Rumpff, Johann Wilhelm  Hertzog, Wilhelm  Voigt, Gottlieb Christian  Thülmeier, Wilhelm Friederich: Ehren-Gedächtnüß Uber die Solenne Leichen-Begängnüß Des Hoch-Ehrwürdigen ... Herrn, Wilhelm Friederich Thülmeiers, Königl. Preußischen Hoff- und Ober-Predigers der Deutschen Reformierten Gemeinde in Magdeburg  Nachdem Derselbe ... den 5. December Anno 1708. ... Verstorben, und Sein Leichnam den 9. darauf ... beerdiget worden. Magdeburg  Berlin 1708	Magdeburg	Historische Drucke	Ehren-Gedächtnüß Uber die Solenne Leichen-Begängnüß Des Hoch-Ehrwürdigen ... Herrn, Wilhelm Friederich Thülmeiers, Königl. Preußischen Hoff- und Ober-Predigers der Deutschen Reformierten Gemeinde in Magdeburg	Monograph
PPN836703405	Diecmann, Johannes	Staatsbibliothek zu Berlin - Preußischer Kulturbesitz	1720	image/jpeg	http://resolver.staatsbibliothek-berlin.de/SBB0001B52D00000000	http://resolver.staatsbibliothek-berlin.de/SBB0001B52D00000000	1720	http://digital.staatsbibliothek-berlin.de/europeana/PPN836703405/00000001.tif	Staatsbibliothek zu Berlin - Preußischer Kulturbesitz	Holwein	Open Access	Diecmann, Johannes: Die Grosse Glaubens-Stärcke Und die von Christo dabey Gezeigte Gnaden-Wercke  Welche an dem ... Herrn Johanni Diecmanno, Der Heiligen Schrifft Hoch-Berühmten Doctori, Ihr. Königl. Majestät von Groß-Britannien und Chur-Fürstl. Durchl. zu Braunschweig und Lüneburg in denen Hertzogthümern Bremen und Verden Hoch-verordneten General-Superintendenti ... In dessen Leben und Sterben wargenommen Und Von der gesamten Priesterschafft Der Neuhäusischen Præpositur. Bey dem ... Abschied desselben ... Entworffen worden Aus dem Von dem Hoch-sehligen erwehlten Leichen-Text So genommen Aus dem XXVII, Psalm v. 1.. Stade  Berlin 1720	Stade	Historische Drucke	Die Grosse Glaubens-Stärcke Und die von Christo dabey Gezeigte Gnaden-Wercke	Monograph
PPN83643286X	Erythropilus, D. R.  Lloyd, William	Staatsbibliothek zu Berlin - Preußischer Kulturbesitz	1717	image/jpeg	http://resolver.staatsbibliothek-berlin.de/SBB0001B50B00000000	http://resolver.staatsbibliothek-berlin.de/SBB0001B50B00000000	1717	http://digital.staatsbibliothek-berlin.de/europeana/PPN83643286X/00000001.tif	Staatsbibliothek zu Berlin - Preußischer Kulturbesitz	Ammonius	Open Access	Erythropilus, D. R.  Lloyd, William: Pietas & Justa in cineres nuper Beate defuncti Maxime Reverendi in Christo Patris D. Wilhelmi Episcopi Vigorniensis in Anglia. Hannoverae  Berlin 1717	Hannoverae	Historische Drucke	Pietas & Justa in cineres nuper Beate defuncti Maxime Reverendi in Christo Patris D. Wilhelmi Episcopi Vigorniensis in Anglia	Monograph
PPN836446267	Diecmannus, Joannes	Staatsbibliothek zu Berlin - Preußischer Kulturbesitz	1720	image/jpeg	http://resolver.staatsbibliothek-berlin.de/SBB0001B50F00000000	http://resolver.staatsbibliothek-berlin.de/SBB0001B50F00000000	1720	http://digital.staatsbibliothek-berlin.de/europeana/PPN836446267/00000001.tif	Staatsbibliothek zu Berlin - Preußischer Kulturbesitz	Holwein	Open Access	Diecmannus, Joannes: Cippvs Viro. Gravi Svmmeqve. Venerabili Ioanni. Diecmanno Doctori. Theologo Et Svperintendenti Generali Sacer. Stadae  Berlin 1720	Stadae	Historische Drucke	Cippvs Viro. Gravi Svmmeqve. Venerabili Ioanni. Diecmanno Doctori. Theologo Et Svperintendenti Generali Sacer	Monograph
PPN836712552	Roth, Eberhard Rudolph	Staatsbibliothek zu Berlin - Preußischer Kulturbesitz	1701	image/jpeg	http://resolver.staatsbibliothek-berlin.de/SBB0001B53400000000	http://resolver.staatsbibliothek-berlin.de/SBB0001B53400000000	1701	http://digital.staatsbibliothek-berlin.de/europeana/PPN836712552/00000009.tif	Staatsbibliothek zu Berlin - Preußischer Kulturbesitz	Wagner	Open Access	Roth, Eberhard Rudolph: Memorabilia Europæ, Oder Denckwürdigste Sachen, Welche Ein Räysender in den fürnehmsten Städten, Schlössern und Oertern Europæ heutiges Tages zu observiren ... hat. Ulm  Berlin 1701	Ulm	Historische Drucke	Memorabilia Europæ, Oder Denckwürdigste Sachen, Welche Ein Räysender in den fürnehmsten Städten, Schlössern und Oertern Europæ heutiges Tages zu observiren ... hat	Monograph
PPN836450124	Diecmann, Johannes	Staatsbibliothek zu Berlin - Preußischer Kulturbesitz	1720	image/jpeg	http://resolver.staatsbibliothek-berlin.de/SBB0001B51600000000	http://resolver.staatsbibliothek-berlin.de/SBB0001B51600000000	1720	http://digital.staatsbibliothek-berlin.de/europeana/PPN836450124/00000001.tif	Staatsbibliothek zu Berlin - Preußischer Kulturbesitz	Holwein	Open Access	Diecmann, Johannes: Die Gefallene Ceder des Bremischen und Verdischen Zions  Bey Dem Höchst-schmertzlichen Todes-Fall Des ... Herrn Johannis Diecmann, Der Heiligen Schrifft Hochberühmten Doctoris, Ihr. Groß-Britannischen Königl. Majestät und Churfürstl. Durchl. zu Braunschweig und Lüneburg in den Hertzogthümern Bremen und Verden Hochverdienten General-Superintendenten, Als Derselbe den 4ten Julii dieses 1720sten Jahrs ... entschlafen, Und Darauf den 19ten Julii Die ... Leich-Begängniß Gehalten ward. ... Vorgestellet. Stade  Berlin 1720	Stade	Historische Drucke	Die Gefallene Ceder des Bremischen und Verdischen Zions	Monograph
PPN837309840	Rüdiger, Johann Anton  Busch, Georg Paul  Freylinghausen, Johann Anastasius	Staatsbibliothek zu Berlin - Preußischer Kulturbesitz	1740	image/jpeg	http://resolver.staatsbibliothek-berlin.de/SBB0001B5CB00000000	http://resolver.staatsbibliothek-berlin.de/SBB0001B5CB00000000	1740	http://digital.staatsbibliothek-berlin.de/europeana/PPN837309840/00000007.tif	Staatsbibliothek zu Berlin - Preußischer Kulturbesitz	Waysenhaus	Open Access	Rüdiger, Johann Anton  Busch, Georg Paul  Freylinghausen, Johann Anastasius: Wohlverdientes Ehren-Gedächtniß Des Um die Kirche Christi treuverdienten Theologi, Deß weyland Hoch-Ehrwürdigen, in Gott Andächtigen und Hochgelahrten Herrn, Herrn Johann Anastasii Freylinghausens, Pastoris bey St. Ulrich in Halle, des Gymnasii alda Scholarchae, wie auch Directoris des Paedagii Regii und des Wäysenhauses zu Glaucha  mittelst der nach Seinem Am 12ten Febr. 1739 erfolgten seligen Ableben hiernächst Am Tage Seiner öffentlichen Leichen-Begängniß (so da war der 17te eiusdem) Gehaltenen Predigt und Stand-Rede, ferner des eigenhändig aufgesetzten Lebens-Laufs, wie auch Der eingesandten Epicediorum und anderer dahin gehörigen Stücke gestiftet Und der Nachwelt zum Besten ans Licht gestellet. Halle  Berlin 1740	Halle	Historische Drucke	Wohlverdientes Ehren-Gedächtniß Des Um die Kirche Christi treuverdienten Theologi, Deß weyland Hoch-Ehrwürdigen, in Gott Andächtigen und Hochgelahrten Herrn, Herrn Johann Anastasii Freylinghausens, Pastoris bey St. Ulrich in Halle, des Gymnasii alda Scholarchae, wie auch Directoris des Paedagii Regii und des Wäysenhauses zu Glaucha	Monograph
