PPN	creator	dataProvider	date	format	identifier	isShownAt	issued	object	provider	publisher	rights	source	spatial	subject	title	type
PPN833971034	Ayrmannus, Christophorus Fridericus  Hartungius, Joannes Godofredus	Staatsbibliothek zu Berlin - Preußischer Kulturbesitz	1727	image/jpeg	http://resolver.staatsbibliothek-berlin.de/SBB0001AEDA00000000	http://resolver.staatsbibliothek-berlin.de/SBB0001AEDA00000000	1727	http://digital.staatsbibliothek-berlin.de/europeana/PPN833971034/00000001.tif	Staatsbibliothek zu Berlin - Preußischer Kulturbesitz	Officina Academ. Typograph. Vulpiana	Open Access	Ayrmannus, Christophorus Fridericus  Hartungius, Joannes Godofredus: Fasces Rectorales, Ad Virvm Magnificvm, Consvltissimvm, Excellentissimvm, Dominvm Io. Godofredvm Hartvngivm, ... Ivris Vtrivsqve Doctorem Et Professorem Primarivm, In Alma Lvdoviciana, Kalendis Ianvarii A.R.G. M DCC XXVII, Prima Vice Delatos, Ecloga In Lavdem Eivs Conscripta. Giessæ  Berlin 1727	Giessæ	Historische Drucke	Fasces Rectorales, Ad Virvm Magnificvm, Consvltissimvm, Excellentissimvm, Dominvm Io. Godofredvm Hartvngivm, ... Ivris Vtrivsqve Doctorem Et Professorem Primarivm, In Alma Lvdoviciana, Kalendis Ianvarii A.R.G. M DCC XXVII, Prima Vice Delatos, Ecloga In Lavdem Eivs Conscripta	Monograph
PPN830331719	Wagnerus, Rudolphus Christianus	Staatsbibliothek zu Berlin - Preußischer Kulturbesitz	1717	image/jpeg	http://resolver.staatsbibliothek-berlin.de/SBB0001A7D500000000	http://resolver.staatsbibliothek-berlin.de/SBB0001A7D500000000	1717	http://digital.staatsbibliothek-berlin.de/europeana/PPN830331719/00000001.tif	Staatsbibliothek zu Berlin - Preußischer Kulturbesitz	Hammius	Open Access	Wagnerus, Rudolphus Christianus: Oda Gratvlatoria Viro Magnifico Atqve Experientissimo Rvdolpho Christiano Wagnero Medicinæ Doctori Physices Atqve Mathematvm Professori Ordinario Fasces Academiæ Jvliæ D. XVI. Jvlii A. M D CCXVII. Secvndvm Capessenti. Helmstadii  Berlin 1717	Helmstadii	Historische Drucke	Oda Gratvlatoria Viro Magnifico Atqve Experientissimo Rvdolpho Christiano Wagnero Medicinæ Doctori Physices Atqve Mathematvm Professori Ordinario Fasces Academiæ Jvliæ D. XVI. Jvlii A. M D CCXVII. Secvndvm Capessenti	Monograph
PPN834085828	Hofmeisterus, Johannes Melchior	Staatsbibliothek zu Berlin - Preußischer Kulturbesitz	1728	image/jpeg	http://resolver.staatsbibliothek-berlin.de/SBB0001AF4100000000	http://resolver.staatsbibliothek-berlin.de/SBB0001AF4100000000	1728	http://digital.staatsbibliothek-berlin.de/europeana/PPN834085828/00000001.tif	Staatsbibliothek zu Berlin - Preußischer Kulturbesitz	Literis Bucholzianis	Open Access	Hofmeisterus, Johannes Melchior: Exemplum Præclari Iureconsulti In Viro Consultissimo, Doctissimo Johanne Melchiore Hofmeistero, Hildesiensi, Candidato Celeberrimo  Qui Summos In Utroque Iure Honores Doctorales Die XXII. Decemb. Anni M DCCXXIIX. In Musarum, Quæ Helmstadii Est, Sede Impetrat, Ea, Qua Par Est, Observantia Admirantur Hildesienses In Academia Iulia Cives. Helmstadii  Berlin 1728	Helmstadii	Historische Drucke	Exemplum Præclari Iureconsulti In Viro Consultissimo, Doctissimo Johanne Melchiore Hofmeistero, Hildesiensi, Candidato Celeberrimo	Monograph
PPN828624410	Honnerbach, Petrus	Staatsbibliothek zu Berlin - Preußischer Kulturbesitz	1777	image/jpeg	http://resolver.staatsbibliothek-berlin.de/SBB0001A48400000000	http://resolver.staatsbibliothek-berlin.de/SBB0001A48400000000	1777	http://digital.staatsbibliothek-berlin.de/europeana/PPN828624410/00000001.tif	Staatsbibliothek zu Berlin - Preußischer Kulturbesitz	Typ. Academico-Aulica	Open Access	Honnerbach, Petrus: Exercitium Ex Theologia Morali De Beneficiis Ecclesiasticis, Clericorum Iuribus, Et Obligationibus Inde Descendentibus. Bonnae  Berlin 1777	Bonnae	Historische Drucke	Exercitium Ex Theologia Morali De Beneficiis Ecclesiasticis, Clericorum Iuribus, Et Obligationibus Inde Descendentibus	Monograph
PPN833187406	Schallmeyer, Iustinianus  Kræuser, Antonius	Staatsbibliothek zu Berlin - Preußischer Kulturbesitz	1779	image/jpeg	http://resolver.staatsbibliothek-berlin.de/SBB0001ACD900000000	http://resolver.staatsbibliothek-berlin.de/SBB0001ACD900000000	1779	http://digital.staatsbibliothek-berlin.de/europeana/PPN833187406/00000001.tif	Staatsbibliothek zu Berlin - Preußischer Kulturbesitz	Typ. Electorali-Academica	Open Access	Schallmeyer, Iustinianus  Kræuser, Antonius: Positiones Historico-Dogmatico Theologicæ De Deo Tri-Uno  Quas In Aula Maiori Academiæ Maximilianeæ Bonnensis. Bonnae  Berlin 1779	Bonnae	Historische Drucke	Positiones Historico-Dogmatico Theologicæ De Deo Tri-Uno	Monograph
PPN641620284	None	Staatsbibliothek zu Berlin - Preußischer Kulturbesitz	1731	image/jpeg	http://resolver.staatsbibliothek-berlin.de/SBB000039FB00000000	http://resolver.staatsbibliothek-berlin.de/SBB000039FB00000000	1731	http://digital.staatsbibliothek-berlin.de/europeana/PPN641620284/00000001.tif	Staatsbibliothek zu Berlin - Preußischer Kulturbesitz	Lange	Open Access	Edict, Daß Nach Verlauff sechs Monate Die Dienst-Mägde Und gantz gemeinen Weibesleute/ Sowohl Christen als Juden, Keine Seidene Röcke, Camisöler und Lätze ferner tragen sollen  De Dato Berlin, den 6ten Novembris 1731. Halberstadt  Berlin 1731	Halberstadt	Historische Drucke	Edict, Daß Nach Verlauff sechs Monate Die Dienst-Mägde Und gantz gemeinen Weibesleute/ Sowohl Christen als Juden, Keine Seidene Röcke, Camisöler und Lätze ferner tragen sollen	Monograph
PPN83406717X	Schrammius, Jonas Conradus	Staatsbibliothek zu Berlin - Preußischer Kulturbesitz	1728	image/jpeg	http://resolver.staatsbibliothek-berlin.de/SBB0001AF3000000000	http://resolver.staatsbibliothek-berlin.de/SBB0001AF3000000000	1728	http://digital.staatsbibliothek-berlin.de/europeana/PPN83406717X/00000001.tif	Staatsbibliothek zu Berlin - Preußischer Kulturbesitz	Bucholzius	Open Access	Schrammius, Jonas Conradus: Bona Verba Viro Magnifico Svmmeqve Reverendo Jonae Conrado Schrammio SS. Theol. Doct. ... Sceptra Academica Inter Favstas Bonorvm Acclamationes Capessenti. Helmstadii  Berlin 1728	Helmstadii	Historische Drucke	Bona Verba Viro Magnifico Svmmeqve Reverendo Jonae Conrado Schrammio SS. Theol. Doct. ... Sceptra Academica Inter Favstas Bonorvm Acclamationes Capessenti	Monograph
PPN833962922	Sinnigen, Sigismundus  Hohenschurz, J. Josephus  Honecker, J. Henricus	Staatsbibliothek zu Berlin - Preußischer Kulturbesitz	1781	image/jpeg	http://resolver.staatsbibliothek-berlin.de/SBB0001AECF00000000	http://resolver.staatsbibliothek-berlin.de/SBB0001AECF00000000	1781	http://digital.staatsbibliothek-berlin.de/europeana/PPN833962922/00000001.tif	Staatsbibliothek zu Berlin - Preußischer Kulturbesitz	Abshoven	Open Access	Sinnigen, Sigismundus  Hohenschurz, J. Josephus  Honecker, J. Henricus: Positiones Ex Universa Theologia Morali. Bonnae  Berlin 1781	Bonnae	Historische Drucke	Positiones Ex Universa Theologia Morali	Monograph
PPN830002308	Hardt, Hermannus  Schmidt, Johann Andreas  Wideburgius, Christophorus Tobias  Weise, Fridericus  Böhmer, Justus Christophorus  Ritmeier, Christophorus Henricus  Engelbrecht, Johannes Wilhelmus  Leyserus, Augustinus  Kreß, Joann Paul  Meibomius, Brandanus  Wagner, Rudolf Christian  Koch, Cornelius Dietericus  Sprecher, J. D.  Müllerus, Georgius Henricus	Staatsbibliothek zu Berlin - Preußischer Kulturbesitz	1715	image/jpeg	http://resolver.staatsbibliothek-berlin.de/SBB0001A6EC00000000	http://resolver.staatsbibliothek-berlin.de/SBB0001A6EC00000000	1715	http://digital.staatsbibliothek-berlin.de/europeana/PPN830002308/00000001.tif	Staatsbibliothek zu Berlin - Preußischer Kulturbesitz	Hammius	Open Access	Hardt, Hermannus  Schmidt, Johann Andreas  Wideburgius, Christophorus Tobias  Weise, Fridericus  Böhmer, Justus Christophorus  Ritmeier, Christophorus Henricus  Engelbrecht, Johannes Wilhelmus  Leyserus, Augustinus  Kreß, Joann Paul  Meibomius, Brandanus  Wagner, Rudolf Christian  Koch, Cornelius Dietericus  Sprecher, J. D.  Müllerus, Georgius Henricus: Carmina Gratvlatoria In Honorem Viri Nobilissimi Et Consvltissimi Domini Georgii Henrici Mv̈lleri Noribergensis Jvris Vtrivsqve Doctorandi Cvm A. D. XXIV. Septembr. MDCCXV. In Pvblico Collegii Loco ... Crearetvr Proclamaretvr. Helmstadii  Berlin 1715	Helmstadii	Historische Drucke	Carmina Gratvlatoria In Honorem Viri Nobilissimi Et Consvltissimi Domini Georgii Henrici Mv̈lleri Noribergensis Jvris Vtrivsqve Doctorandi Cvm A. D. XXIV. Septembr. MDCCXV. In Pvblico Collegii Loco ... Crearetvr Proclamaretvr	Monograph
PPN832635723	Detharding, Georgius  Barnstorffius, Bernhardus	Staatsbibliothek zu Berlin - Preußischer Kulturbesitz	1704	image/jpeg	http://resolver.staatsbibliothek-berlin.de/SBB0001AA5100000000	http://resolver.staatsbibliothek-berlin.de/SBB0001AA5100000000	1704	http://digital.staatsbibliothek-berlin.de/europeana/PPN832635723/00000001.tif	Staatsbibliothek zu Berlin - Preußischer Kulturbesitz	Wepplingius	Open Access	Detharding, Georgius  Barnstorffius, Bernhardus: Programma Quo Ad Iusta Solemnia Viro ... Bernhardo Barnstorffio Medic. D. Et Professor Publ. Ordinar. Poliatro Item Rostochiensi Hodie Instituenda Omnes Reipubl. Literar. Cives Amplissimæ Facult. Medicæ Nomine Officiose Ac Amanter Invitat. Rostochii  Berlin 1704	Rostochii	Historische Drucke	Programma Quo Ad Iusta Solemnia Viro ... Bernhardo Barnstorffio Medic. D. Et Professor Publ. Ordinar. Poliatro Item Rostochiensi Hodie Instituenda Omnes Reipubl. Literar. Cives Amplissimæ Facult. Medicæ Nomine Officiose Ac Amanter Invitat	Monograph
PPN833483277	Moshemius, Joannes Laurentius  Heumannus, Christophorus Augustus	Staatsbibliothek zu Berlin - Preußischer Kulturbesitz	1728	image/jpeg	http://resolver.staatsbibliothek-berlin.de/SBB0001ADB000000000	http://resolver.staatsbibliothek-berlin.de/SBB0001ADB000000000	1728	http://digital.staatsbibliothek-berlin.de/europeana/PPN833483277/00000001.tif	Staatsbibliothek zu Berlin - Preußischer Kulturbesitz	Schnorrius	Open Access	Moshemius, Joannes Laurentius  Heumannus, Christophorus Augustus: Ad Cursorias Lectiones Et Disputationem Inauguralem Viri Maxime Reverendi Et Amplissimi Christophori Augusti Heumanni, Gymnasii Regii Göttingensis Inspectoris Et SS. Theol. Professoris, Audiendam Magnificum Dominum Prorectorem, Spectabiles Decanos, Professores Omnium Ordinum Excellentissimos, Cives Academiae Nobilissimos, Omnesque Litterarum Fautores, Quo Decet Quemvis Studio Invitat. Helmstadii  Berlin 1728	Helmstadii	Historische Drucke	Ad Cursorias Lectiones Et Disputationem Inauguralem Viri Maxime Reverendi Et Amplissimi Christophori Augusti Heumanni, Gymnasii Regii Göttingensis Inspectoris Et SS. Theol. Professoris, Audiendam Magnificum Dominum Prorectorem, Spectabiles Decanos, Professores Omnium Ordinum Excellentissimos, Cives Academiae Nobilissimos, Omnesque Litterarum Fautores, Quo Decet Quemvis Studio Invitat	Monograph
PPN829995714	Werlhofius, Joannes Henricus  Engelbrechtus, Georgius	Staatsbibliothek zu Berlin - Preußischer Kulturbesitz	1714	image/jpeg	http://resolver.staatsbibliothek-berlin.de/SBB0001A6E300000000	http://resolver.staatsbibliothek-berlin.de/SBB0001A6E300000000	1714	http://digital.staatsbibliothek-berlin.de/europeana/PPN829995714/00000001.tif	Staatsbibliothek zu Berlin - Preußischer Kulturbesitz	Hammius	Open Access	Werlhofius, Joannes Henricus  Engelbrechtus, Georgius: Viro Magnifico Amplissimo Atqve Consvltissimo Georgio Engelbrechto Ivris Canonici Et Fevdalis Professori Celeberrimo Pvrpvram Academicam Et Splendidos Ivliae Fasces D. v. Ivlii Anni M D CCXIIII.. Helmstadii  Berlin 1714	Helmstadii	Historische Drucke	Viro Magnifico Amplissimo Atqve Consvltissimo Georgio Engelbrechto Ivris Canonici Et Fevdalis Professori Celeberrimo Pvrpvram Academicam Et Splendidos Ivliae Fasces D. v. Ivlii Anni M D CCXIIII.	Monograph
PPN829999604	Uhnius, Henricus Christianus  Sperlette, Johannes	Staatsbibliothek zu Berlin - Preußischer Kulturbesitz	1715	image/jpeg	http://resolver.staatsbibliothek-berlin.de/SBB0001A6E800000000	http://resolver.staatsbibliothek-berlin.de/SBB0001A6E800000000	1715	http://digital.staatsbibliothek-berlin.de/europeana/PPN829999604/00000001.tif	Staatsbibliothek zu Berlin - Preußischer Kulturbesitz	Grunerus	Open Access	Uhnius, Henricus Christianus  Sperlette, Johannes: Epos Charmosynosōtērion, quod, cum Magnificus ... Dn. Johannes Sperlette, Potentissimi Boruss. Regis Consiliarius, Philosophiae moralis ... Mvnvs Pro-Rectoratvs, quod hoc anno non minore felicitate, et prudentia, quam ante decennium, sustinuit, Applavdente Vniversa Academia, ex solenni festivitatis publicae ritu die XII. Iulii, anno MDCCXV, Magnifico, iuxta et Dignissimo Svccessori deferret, meditari, et vna obsequium, honorisque debitum cultum erga Tantvm Favtorem declarare voluit, debuit M. Henricvs Christianvs Vhnivs, Philologiae Cultor, et Gymn. Hall. Sept.. Halae Magdeburgicae  Berlin 1715	Halae Magdeburgicae	Historische Drucke	Epos Charmosynosōtērion, quod, cum Magnificus ... Dn. Johannes Sperlette, Potentissimi Boruss. Regis Consiliarius, Philosophiae moralis ... Mvnvs Pro-Rectoratvs, quod hoc anno non minore felicitate, et prudentia, quam ante decennium, sustinuit, Applavdente Vniversa Academia, ex solenni festivitatis publicae ritu die XII. Iulii, anno MDCCXV, Magnifico, iuxta et Dignissimo Svccessori deferret, meditari, et vna obsequium, honorisque debitum cultum erga Tantvm Favtorem declarare voluit, debuit M. Henricvs Christianvs Vhnivs, Philologiae Cultor, et Gymn. Hall. Sept.	Monograph
PPN833486632	Humperdink, Petrus Josephus	Staatsbibliothek zu Berlin - Preußischer Kulturbesitz	1780	image/jpeg	http://resolver.staatsbibliothek-berlin.de/SBB0001ADBD00000000	http://resolver.staatsbibliothek-berlin.de/SBB0001ADBD00000000	1780	http://digital.staatsbibliothek-berlin.de/europeana/PPN833486632/00000001.tif	Staatsbibliothek zu Berlin - Preußischer Kulturbesitz	Typ. Electorali-Academica	Open Access	Humperdink, Petrus Josephus: Meditatio Iuridica Ad Tit. VIII. §. 8. Ordinationis Patriæ Coloniensis  Quam Una Cum Corollariis Ex Iure Civili Pandectarum Tentamini Academico Submittet. Bonnae  Berlin 1780	Bonnae	Historische Drucke	Meditatio Iuridica Ad Tit. VIII. §. 8. Ordinationis Patriæ Coloniensis	Monograph
PPN833484923	Steinbrück, Joachim Bernhard  Steinbrück, Michael Mathias	Staatsbibliothek zu Berlin - Preußischer Kulturbesitz	1763	image/jpeg	http://resolver.staatsbibliothek-berlin.de/SBB0001ADB600000000	http://resolver.staatsbibliothek-berlin.de/SBB0001ADB600000000	1763	http://digital.staatsbibliothek-berlin.de/europeana/PPN833484923/00000001.tif	Staatsbibliothek zu Berlin - Preußischer Kulturbesitz	Spiegel	Open Access	Steinbrück, Joachim Bernhard  Steinbrück, Michael Mathias: Das Leben seines Vaters, Michael Mathias Steinbrücks  Diaconus zu Falkenburg, und Pastors zu Dietersdorf [et]c. der Dramburgischen Priesterschaft in der neuen Mark Brandenburg Subseniors, zur angewünschten reichen Erbauung seiner ehemaligen Zuhörer, auf Verlangen eines werthen Freundes entworfen. Stettin  Berlin 1763	Stettin	Historische Drucke	Das Leben seines Vaters, Michael Mathias Steinbrücks	Monograph
PPN833968084	Engelbrecht, Georgius	Staatsbibliothek zu Berlin - Preußischer Kulturbesitz	1714	image/jpeg	http://resolver.staatsbibliothek-berlin.de/SBB0001AED600000000	http://resolver.staatsbibliothek-berlin.de/SBB0001AED600000000	1714	http://digital.staatsbibliothek-berlin.de/europeana/PPN833968084/00000001.tif	Staatsbibliothek zu Berlin - Preußischer Kulturbesitz	Schnorriano	Open Access	Engelbrecht, Georgius: Cum Illustris Academia Julia Viro Magnifico Excellentissimo, Consultissimoq[ue] Domino Georgio Engelbrecht. Helmstadi[i]  Berlin 1714	Helmstadi[i]	Historische Drucke	Cum Illustris Academia Julia Viro Magnifico Excellentissimo, Consultissimoq[ue] Domino Georgio Engelbrecht	Monograph
PPN832075914	Koch, Cornelius Dieterich	Staatsbibliothek zu Berlin - Preußischer Kulturbesitz	1724	image/jpeg	http://resolver.staatsbibliothek-berlin.de/SBB0001A90B00000000	http://resolver.staatsbibliothek-berlin.de/SBB0001A90B00000000	1724	http://digital.staatsbibliothek-berlin.de/europeana/PPN832075914/00000001.tif	Staatsbibliothek zu Berlin - Preußischer Kulturbesitz	Schnorr	Open Access	Koch, Cornelius Dieterich: Die Kennzeichen Eines Klugen Regenten Wolte Als Der Hochwürdige ... Herr Cornel. Dieterich Koch/ Th. Ac Philos. D. Et P.P.O. Auf der Hochlöbl. Jvlivs-Vniversität zu Helmstädt Den 4. Jan. dieses 1724 Jahres Die Hohe Würde Des Vice-Rectorats Zum Drittenmahl übernahm, Zu Bezeigung seines schuldigsten Respects ... vorstellen. Helmstädt  Berlin 1724	Helmstädt	Historische Drucke	Die Kennzeichen Eines Klugen Regenten Wolte Als Der Hochwürdige ... Herr Cornel. Dieterich Koch/ Th. Ac Philos. D. Et P.P.O. Auf der Hochlöbl. Jvlivs-Vniversität zu Helmstädt Den 4. Jan. dieses 1724 Jahres Die Hohe Würde Des Vice-Rectorats Zum Drittenmahl übernahm, Zu Bezeigung seines schuldigsten Respects ... vorstellen	Monograph
PPN83263848X	Obenberger, Constantius  Gabler, Ludgerus  Saur, Henricus  Jansen, Wilhelmus Josephus	Staatsbibliothek zu Berlin - Preußischer Kulturbesitz	1778	image/jpeg	http://resolver.staatsbibliothek-berlin.de/SBB0001AA5700000000	http://resolver.staatsbibliothek-berlin.de/SBB0001AA5700000000	1778	http://digital.staatsbibliothek-berlin.de/europeana/PPN83263848X/00000001.tif	Staatsbibliothek zu Berlin - Preußischer Kulturbesitz	Typ. Academico-Aulica	Open Access	Obenberger, Constantius  Gabler, Ludgerus  Saur, Henricus  Jansen, Wilhelmus Josephus: Positiones Ex Universa Theologia Selectiores  Quas Una Cum Parergis Historico-Criticis. Bonnae  Berlin 1778	Bonnae	Historische Drucke	Positiones Ex Universa Theologia Selectiores	Monograph
PPN828233705	Werner, Adam Balthasar	Staatsbibliothek zu Berlin - Preußischer Kulturbesitz	1705	image/jpeg	http://resolver.staatsbibliothek-berlin.de/SBB0001A36500000000	http://resolver.staatsbibliothek-berlin.de/SBB0001A36500000000	1705	http://digital.staatsbibliothek-berlin.de/europeana/PPN828233705/00000005.tif	Staatsbibliothek zu Berlin - Preußischer Kulturbesitz	Meyer	Open Access	Werner, Adam Balthasar: Den Antritt der schweren Regierung beglückwünschen Dem Hoch-Edlen  ... Herrn Adam Balthasar Werner, Icto ... bey hiesiger Löbl. Universität Altdorf ... Professori Publico, nunmehr Höchst-erwünschten Rectori Magnifico auf erstberührter Hoch-Löbl. Universität den 1. Julii 1705. Ihrer Magnificenz ergebenste Auditores. [Altdorf]  Berlin 1705	[Altdorf]	Historische Drucke	Den Antritt der schweren Regierung beglückwünschen Dem Hoch-Edlen	Monograph
PPN834045419	Grellius, Christianus Augustus  Gellertus, Johannes Augustus	Staatsbibliothek zu Berlin - Preußischer Kulturbesitz	1728	image/jpeg	http://resolver.staatsbibliothek-berlin.de/SBB0001AF2000000000	http://resolver.staatsbibliothek-berlin.de/SBB0001AF2000000000	1728	http://digital.staatsbibliothek-berlin.de/europeana/PPN834045419/00000001.tif	Staatsbibliothek zu Berlin - Preußischer Kulturbesitz	Buchholtzius	Open Access	Grellius, Christianus Augustus  Gellertus, Johannes Augustus: Cvm Viri Consvltissimi Et Doctissimi Domini Christian. Avg. Grellivs Pegavio-Misnicvs Et Joh. Avgvstvs Gellertvs Ciza-Misnicvs Exantlatis Stvdiis Academicis Et Dissertationibvs Inavgvralibvs ...  In Illvstri Academia Regio-Dvcali Jvlia Vtrivsqve Ivris Doctores Consvetis Solemnitatibvs D. XIII. Kal. Avgvst. MDCCXXVIII.. Helmstadii  Berlin 1728	Helmstadii	Historische Drucke	Cvm Viri Consvltissimi Et Doctissimi Domini Christian. Avg. Grellivs Pegavio-Misnicvs Et Joh. Avgvstvs Gellertvs Ciza-Misnicvs Exantlatis Stvdiis Academicis Et Dissertationibvs Inavgvralibvs ...	Monograph
PPN833821644	Süßmilch, Carl Christian  Süßmilch, Charlotta Catharina  Süßmilch, Johanna Dorothea  Meil, Johann Wilhelm	Staatsbibliothek zu Berlin - Preußischer Kulturbesitz	1759	image/jpeg	http://resolver.staatsbibliothek-berlin.de/SBB0001AEA800000000	http://resolver.staatsbibliothek-berlin.de/SBB0001AEA800000000	1759	http://digital.staatsbibliothek-berlin.de/europeana/PPN833821644/00000001.tif	Staatsbibliothek zu Berlin - Preußischer Kulturbesitz	Winter	Open Access	Süßmilch, Carl Christian  Süßmilch, Charlotta Catharina  Süßmilch, Johanna Dorothea  Meil, Johann Wilhelm: Die Herrlichkeit Gottes  Ein Gesang. Ihren verehrungswürdigsten Ältern zum Neuen Jahre 1759 gewidmet. Berlin  Berlin 1759	Berlin	Historische Drucke	Die Herrlichkeit Gottes	Monograph
PPN83327368X	Obenberger, Constantius  Schmitz, Cyrillus  Holz, Aloysius	Staatsbibliothek zu Berlin - Preußischer Kulturbesitz	1779	image/jpeg	http://resolver.staatsbibliothek-berlin.de/SBB0001AD2500000000	http://resolver.staatsbibliothek-berlin.de/SBB0001AD2500000000	1779	http://digital.staatsbibliothek-berlin.de/europeana/PPN83327368X/00000001.tif	Staatsbibliothek zu Berlin - Preußischer Kulturbesitz	Typ. Electorali-Academica	Open Access	Obenberger, Constantius  Schmitz, Cyrillus  Holz, Aloysius: Positiones Ex Præcipuis Theologiæ Dogmaticæ Tractatibus Selectæ  Quas Una Cum Parergis Historico-Criticis. Bonnae  Berlin 1779	Bonnae	Historische Drucke	Positiones Ex Præcipuis Theologiæ Dogmaticæ Tractatibus Selectæ	Monograph
PPN832273031	Mehlem, Johann Josef  Bruckmann, Laurentius	Staatsbibliothek zu Berlin - Preußischer Kulturbesitz	1778	image/jpeg	http://resolver.staatsbibliothek-berlin.de/SBB0001A99D00000000	http://resolver.staatsbibliothek-berlin.de/SBB0001A99D00000000	1778	http://digital.staatsbibliothek-berlin.de/europeana/PPN832273031/00000001.tif	Staatsbibliothek zu Berlin - Preußischer Kulturbesitz	Typ. Academico-Aulica	Open Access	Mehlem, Johann Josef  Bruckmann, Laurentius: Principia Moralia De Votis Et Iuramentis. Bonnae  Berlin 1778	Bonnae	Historische Drucke	Principia Moralia De Votis Et Iuramentis	Monograph
PPN827677286	Königstein, Wilhelmus  Jansen, Josephus	Staatsbibliothek zu Berlin - Preußischer Kulturbesitz	1777	image/jpeg	http://resolver.staatsbibliothek-berlin.de/SBB0001A20700000000	http://resolver.staatsbibliothek-berlin.de/SBB0001A20700000000	1777	http://digital.staatsbibliothek-berlin.de/europeana/PPN827677286/00000001.tif	Staatsbibliothek zu Berlin - Preußischer Kulturbesitz	Tÿp. Academico-Aulica	Open Access	Königstein, Wilhelmus  Jansen, Josephus: Assertiones Ex Theologia Dogmatica De Creatione Et Fine Ultimo Angeli Et Hominis  Selectas in Aula maiori Academica Bonnensi. Bonnae  Berlin 1777	Bonnae	Historische Drucke	Assertiones Ex Theologia Dogmatica De Creatione Et Fine Ultimo Angeli Et Hominis	Monograph
PPN833963244	Schalmayer, Iustinianus	Staatsbibliothek zu Berlin - Preußischer Kulturbesitz	1782	image/jpeg	http://resolver.staatsbibliothek-berlin.de/SBB0001AED000000000	http://resolver.staatsbibliothek-berlin.de/SBB0001AED000000000	1782	http://digital.staatsbibliothek-berlin.de/europeana/PPN833963244/00000001.tif	Staatsbibliothek zu Berlin - Preußischer Kulturbesitz	Abshoven	Open Access	Schalmayer, Iustinianus: Exercitium Canonicum. Bonnae  Berlin 1782	Bonnae	Historische Drucke	Exercitium Canonicum	Monograph
PPN827676778	Collhorst, Sebastianus  Saur, Henricus	Staatsbibliothek zu Berlin - Preußischer Kulturbesitz	1777	image/jpeg	http://resolver.staatsbibliothek-berlin.de/SBB0001A20600000000	http://resolver.staatsbibliothek-berlin.de/SBB0001A20600000000	1777	http://digital.staatsbibliothek-berlin.de/europeana/PPN827676778/00000001.tif	Staatsbibliothek zu Berlin - Preußischer Kulturbesitz	Typ. Aulica	Open Access	Collhorst, Sebastianus  Saur, Henricus: Assertiones Ex Theologia Dogmatica De Deo Tri-Uno  Quas in Aula maiori Academica Bonnensi. Bonnae  Berlin 1777	Bonnae	Historische Drucke	Assertiones Ex Theologia Dogmatica De Deo Tri-Uno	Monograph
PPN83318783X	Hauptmann, Josephus  Meyer, Michael	Staatsbibliothek zu Berlin - Preußischer Kulturbesitz	1779	image/jpeg	http://resolver.staatsbibliothek-berlin.de/SBB0001ACDA00000000	http://resolver.staatsbibliothek-berlin.de/SBB0001ACDA00000000	1779	http://digital.staatsbibliothek-berlin.de/europeana/PPN83318783X/00000001.tif	Staatsbibliothek zu Berlin - Preußischer Kulturbesitz	Typ. Electorali-Academica	Open Access	Hauptmann, Josephus  Meyer, Michael: Positiones Ex Theologia Morali De Actibus Humanis & Conscientia  Quas In Aula Maiori Academiæ Maximilianeæ Bonnensis. Bonnae  Berlin 1779	Bonnae	Historische Drucke	Positiones Ex Theologia Morali De Actibus Humanis & Conscientia	Monograph
PPN833820389	Heidemann, Gotthilf Jodocus  Hecker, Andreas Petrus	Staatsbibliothek zu Berlin - Preußischer Kulturbesitz	1770	image/jpeg	http://resolver.staatsbibliothek-berlin.de/SBB0001AEA300000000	http://resolver.staatsbibliothek-berlin.de/SBB0001AEA300000000	1770	http://digital.staatsbibliothek-berlin.de/europeana/PPN833820389/00000001.tif	Staatsbibliothek zu Berlin - Preußischer Kulturbesitz	Effenbart	Open Access	Heidemann, Gotthilf Jodocus  Hecker, Andreas Petrus: Dieses Gedächtnismaal der Hochachtung und Liebe, bei dem Grabe des ... Herrn Andreas Petrus Hecker, wolverdienten Präpositi und Pastoris Primarii Adiuncti, wie auch treufleißigen Archidiaconi an der Marienkirche zu Stargard, widmet zum Trost der betrübten Leidtragenden. Stettin  Berlin 1770	Stettin	Historische Drucke	Dieses Gedächtnismaal der Hochachtung und Liebe, bei dem Grabe des ... Herrn Andreas Petrus Hecker, wolverdienten Präpositi und Pastoris Primarii Adiuncti, wie auch treufleißigen Archidiaconi an der Marienkirche zu Stargard, widmet zum Trost der betrübten Leidtragenden	Monograph
